{
  "id": "2026-07-17-fixed-admission-final-rule",
  "headline": "What the postponed fixed admission period rule would change for students",
  "plain": "In July 2026, the Department of Homeland Security published a rule to replace duration of status with a fixed period of admission for F, J, and I visa holders. Under it, an F or J stay would run to the program end date, up to 4 years, plus 30 days to depart. The time to prepare to depart after study or practical training would drop from 60 to 30 days. A court in Boston has put off the start of the rule.",
  "source_label": {
    "agency": "Department of Homeland Security",
    "document": "Final rule, 91 FR 44976, FR Doc. 2026-14439",
    "dated": "2026-07-17"
  },
  "topic": "Fixed admission period rule",
  "legal_status": "enjoined",
  "status_as_of": "2026-10-03",
  "categories": [
    "f1"
  ],
  "claims": [
    {
      "text": "The final rule (FR Doc. 2026-14439) changes the admission period in the F, J, and I classifications from duration of status to an admission for a fixed time period.",
      "quote": "The Department of Homeland Security (DHS) is amending its regulations to change the admission period in the F, J, and I classifications from duration of status to an admission for a fixed time period",
      "source_url": "https://www.federalregister.gov/documents/full_text/xml/2026/07/17/2026-14439.xml",
      "source_kind": "primary",
      "source_type": "federal_register",
      "snapshot_sha256": "f9c196f7df36c005f0db288511077ef81229a303ff45cb2fb1061ba6c84befd5",
      "quote_found": true
    },
    {
      "text": "Under the final rule, admission is granted up to the program end date, not to exceed 4 years, plus 30 days for F and J nonimmigrants to depart.",
      "quote": "Upon admission into the United States, a fixed period of stay is granted up to the program end date, not to exceed 4 years, plus an additional 30-days for F and J nonimmigrants to depart.",
      "source_url": "https://www.federalregister.gov/documents/full_text/xml/2026/07/17/2026-14439.xml",
      "source_kind": "primary",
      "source_type": "federal_register",
      "snapshot_sha256": "f9c196f7df36c005f0db288511077ef81229a303ff45cb2fb1061ba6c84befd5",
      "quote_found": true
    },
    {
      "text": "The final rule decreases the period for F-1 nonimmigrants to prepare to depart after a course of study or post-completion practical training from 60 to 30 days.",
      "quote": "Decreasing the period allowed for F-1 nonimmigrants to prepare to depart from the United States after completion of a course of study or an authorized period of post-completion practical training from 60 to 30 days",
      "source_url": "https://www.federalregister.gov/documents/full_text/xml/2026/07/17/2026-14439.xml",
      "source_kind": "primary",
      "source_type": "federal_register",
      "snapshot_sha256": "f9c196f7df36c005f0db288511077ef81229a303ff45cb2fb1061ba6c84befd5",
      "quote_found": true
    },
    {
      "text": "The final rule set its effective date as September 15, 2026.",
      "quote": "The effective date is September 15, 2026.",
      "source_url": "https://www.federalregister.gov/documents/full_text/xml/2026/07/17/2026-14439.xml",
      "source_kind": "primary",
      "source_type": "federal_register",
      "snapshot_sha256": "f9c196f7df36c005f0db288511077ef81229a303ff45cb2fb1061ba6c84befd5",
      "quote_found": true
    },
    {
      "text": "The District of Massachusetts (No. 1:26-cv-13799, ECF 51) postponed the effective date of the final rule on September 14, 2026, until the court orders otherwise or decides the merits.",
      "quote": "The effective date of the Final Rule is hereby POSTPONED pending further order of this court or resolution of this proceeding on the merits.",
      "source_url": "https://storage.courtlistener.com/recap/gov.uscourts.mad.305059/gov.uscourts.mad.305059.51.0_1.pdf",
      "source_kind": "primary",
      "source_type": "court_order",
      "snapshot_sha256": "c211815e43cc9f25b6cc231ab75c8c8151bfe6e26c3a79d147a3642c220db399",
      "quote_found": true
    }
  ],
  "history": [
    {
      "on": "2026-07-17",
      "legal_status": "final",
      "note": "Final rule published at 91 FR 44976, effective date September 15, 2026.",
      "source_url": "https://www.federalregister.gov/documents/full_text/xml/2026/07/17/2026-14439.xml"
    },
    {
      "on": "2026-09-14",
      "legal_status": "enjoined",
      "note": "The District of Massachusetts postponed the effective date and enjoined implementation (ECF 51).",
      "source_url": "https://storage.courtlistener.com/recap/gov.uscourts.mad.305059/gov.uscourts.mad.305059.51.0_1.pdf"
    }
  ],
  "checks": {
    "independent_check_passed": false,
    "refutation_survived": false
  },
  "approval": {
    "approved": false,
    "approved_by": null,
    "approved_at": null
  }
}
