{
  "id": "2026-10-02-presidents-alliance-appeal",
  "headline": "The government appealed the September 14, 2026 order on the fixed admission period rule",
  "plain": "On September 30, 2026, the defendants filed a notice of appeal (ECF 53) from the memorandum and order of September 14, 2026 (ECF 50) in Presidents' Alliance on Higher Education and Immigration v. United States Department of Homeland Security, No. 1:26-cv-13799 (D. Mass.). The First Circuit case number is 26-2112. The order of September 14, 2026 (ECF 51) postponed the effective date of the final rule of July 17, 2026 (FR Doc. 2026-14439) and enjoined the defendants from implementing it, pending further order of the court or a decision on the merits. That final rule would change the admission period in the F, J, and I classifications from duration of status to an admission for a fixed time period. The district court docket listing fetched on October 2, 2026 shows no entry that stays that order. The First Circuit docket was not read.",
  "legal_status": "appealed",
  "status_as_of": "2026-10-02",
  "categories": ["f1"],
  "claims": [
    {
      "text": "The final rule of July 17, 2026 (FR Doc. 2026-14439) would change the admission period in the F, J, and I classifications from duration of status to an admission for a fixed time period. The order of September 14, 2026 (ECF 51) enjoins its implementation.",
      "quote": "The Department of Homeland Security (DHS) is amending its regulations to change the admission period in the F, J, and I classifications from duration of status to an admission for a fixed time period",
      "source_url": "https://www.federalregister.gov/documents/full_text/xml/2026/07/17/2026-14439.xml",
      "source_kind": "primary",
      "source_type": "federal_register",
      "snapshot_sha256": "f9c196f7df36c005f0db288511077ef81229a303ff45cb2fb1061ba6c84befd5",
      "quote_found": true
    },
    {
      "text": "The district court docket listing fetched on October 2, 2026 shows entry 53, filed September 30, 2026: a notice of appeal from the memorandum and order of September 14, 2026 (ECF 50).",
      "quote": "NOTICE OF APPEAL as to 50 Memorandum & ORDER,, by Mullin Markwayne, United States Department of Homeland Security, United States Immigration and Customs Enforcement, David Venturella.",
      "source_url": "https://www.courtlistener.com/api/rest/v4/search/?q=docket_id%3A74661796&type=rd&order_by=entry_date_filed%20desc",
      "source_kind": "primary",
      "snapshot_sha256": "15543122312678f4b0101a5cef8739b9c3da7e30651e8a5c0af3d514c2834bec",
      "quote_found": true
    },
    {
      "text": "The district court docket listing fetched on October 2, 2026 shows entry 55, filed September 30, 2026: the First Circuit case number for the appeal is 26-2112.",
      "quote": "USCA Case Number 26-2112 for 53 Notice of Appeal",
      "source_url": "https://www.courtlistener.com/api/rest/v4/search/?q=docket_id%3A74661796&type=rd&order_by=entry_date_filed%20desc",
      "source_kind": "primary",
      "snapshot_sha256": "15543122312678f4b0101a5cef8739b9c3da7e30651e8a5c0af3d514c2834bec",
      "quote_found": true
    },
    {
      "text": "The district court docket listing fetched on October 2, 2026 shows entry 51, filed September 14, 2026: a preliminary injunction order postponing the effective date of the final rule. Searched for the word stay in every entry of that listing, which holds every entry filed after entry 51: no entry matched. The First Circuit docket for case 26-2112 was not read.",
      "quote": "PRELIMINARY INJUNCTION ORDER POSTPONING EFFECTIVE DATE OF FINAL RULE.",
      "source_url": "https://www.courtlistener.com/api/rest/v4/search/?q=docket_id%3A74661796&type=rd&order_by=entry_date_filed%20desc",
      "source_kind": "primary",
      "snapshot_sha256": "15543122312678f4b0101a5cef8739b9c3da7e30651e8a5c0af3d514c2834bec",
      "quote_found": true
    },
    {
      "text": "The order of September 14, 2026 (ECF 51) enjoins the defendants from implementing the final rule until the court orders otherwise or decides the merits.",
      "quote": "Defendants are preliminarily enjoined from taking any further action to implement the Final Rule pending further order of this court or resolution of this proceeding on the merits.",
      "source_url": "https://storage.courtlistener.com/recap/gov.uscourts.mad.305059/gov.uscourts.mad.305059.51.0_1.pdf",
      "source_kind": "primary",
      "source_type": "court_order",
      "snapshot_sha256": "c211815e43cc9f25b6cc231ab75c8c8151bfe6e26c3a79d147a3642c220db399",
      "quote_found": true
    }
  ],
  "history": [
    {
      "on": "2026-09-30",
      "legal_status": "appealed",
      "note": "Notice of appeal (ECF 53) from the order of September 14, 2026; First Circuit case 26-2112 (ECF 55).",
      "source_url": "https://www.courtlistener.com/api/rest/v4/search/?q=docket_id%3A74661796&type=rd&order_by=entry_date_filed%20desc"
    }
  ],
  "checks": {
    "independent_check_passed": false,
    "refutation_survived": false
  },
  "approval": {
    "approved": false,
    "approved_by": null,
    "approved_at": null
  }
}
